commit	outcome_auroc	outcome_auprc	onset_mae_hrs	peak_vram_gb	status	description
7925c06	0.914243	0.620625	64.95	4.54	KEEP	arch M-256; baseline on real MIMIC-IV 40k patients; P1 19ep dt-fixed, P2 44ep ranking=0.097, P3 49ep vl_select=0.679
d22dadb	0.899748	0.610763	64.72	0.22	DISCARD	arch S-128; 1.67M params; P3 best ep35 vl_select=0.712 (proc died ep40 val, eval-only); RELEASE 0.741 vs 0.835 baseline; AUROC -0.014 below M-256
3c94166	0.898504	0.606415	64.49	0.40	DISCARD	arch M-256-deep; 9.31M params; embed=256 n_layer=6; P3 best ep28 vl_select=0.680 (proc died ep33 val, eval-only); RELEASE 0.751 vs 0.835 baseline; AUROC -0.016 below M-256
b72a0a1	0.899163	0.597074	64.62	0.59	DISCARD	arch L-384; 20.78M params; embed=384 n_layer=6 n_head=6; P3 best ep15 vl_select=0.663 (OOM during eval, eval-only); DEATH 0.919 vs 0.953 baseline; RELEASE 0.795 vs 0.835 baseline; AUROC -0.015 below M-256
ab7aae1	n/a	n/a	n/a	n/a	OOM_EXCLUSION	arch XL-512; ~36.8M params; embed=512 n_layer=6 n_head=8; Phase 2 SIGKILL after ~30-45 min regardless of batch_size (16 and 8 both failed); cumulative RAM growth; hard exclusion per program.md
2da6fc5	0.903003	0.635860	66.00	2.75	DISCARD	arch M-256-QA (USE_QA_DATA=True); 6.42M params; P2 47ep BCE=0.0658, P3 48ep best ep43 vl_select=0.601; RELEASE 0.759 vs 0.835 baseline; AUROC -0.011 below M-256
452cea9	0.910672	0.633363	65.61	0.58	DISCARD	arch L-384-v2 (HP sweep: backbone_lr_factor=0.01→0.10, dropout=0.10→0.15); 20.78M params; P2 52ep vl_total=0.0964; P3 crashed ep11-12 (SIGKILL val ~84%) 3 times; resume+empty_cache fix, best ep6 vl_select=0.656 (eval-only); AUPRC +0.013 vs M-256; AUROC -0.004, MAE +0.66h → DISCARD
5496c9e	0.915040	0.629804	64.98	0.33	KEEP	arch M-256 retrain (Phase D vehicle); same config as 7925c06; P1 early-stop, P2 51ep ranking unlocked ep27, P3 best ep25 vl_select=0.689 (eval-only); AUROC +0.001 vs original M-256 (within noise); Phase D k=2-6 run on these checkpoints
fa63768	0.876407	0.567169	63.70	0.33	DISCARD	arch M-256-QA-proper (USE_QA_DATA=True, tokenizer rebuilt from scratch); P1 early-stop, P2 early-stop, P3 best ep31 vl_select=0.702 (proc died ep36 val, eval-only); AUROC -0.038 below M-256; worse than stale-tokenizer QA run (0.876 vs 0.903); %_PATTERN% tokens add noise
